message,output,flag,username,timestamp
Explain quantum computing in simple terms.,"Explain quantum computing in simple terms.
Quantum computing is a new way of doing computer science that uses the strange properties of tiny particles like atoms and electrons to perform calculations.
In regular computers, information is stored as bits that can be either a 0 or a 1. In quantum computing, information is stored in qubits, which can be both 0 and 1 at the same time. This means that a quantum computer can perform many calculations at once, much faster than a regular computer.
Quantum computers are still very new and experimental, but they have the potential to solve problems that regular computers can't, like breaking super-encryption codes or simulating complex chemical reactions.
Quantum computing is like a special kind of magic that lets computers do things that were previously impossible.",,,2024-09-05 20:33:31.797522
